{
  "$schema": "https://json-schema.org/draft/2020-12/schema",
  "$id": "skyguard/input_row",
  "title": "Input row (one reading from one station)",
  "type": "object",
  "required": [
    "schema_v",
    "station_id",
    "ts_utc",
    "T",
    "Td",
    "RH",
    "P",
    "P_type",
    "cadence_min",
    "source"
  ],
  "properties": {
    "schema_v": {
      "const": "1.0"
    },
    "station_id": {
      "type": "string",
      "minLength": 1
    },
    "ts_utc": {
      "type": "string",
      "pattern": "^\\d{4}-\\d{2}-\\d{2}T\\d{2}:\\d{2}:\\d{2}Z$"
    },
    "ingest_ts_utc": {
      "type": "string",
      "pattern": "^\\d{4}-\\d{2}-\\d{2}T\\d{2}:\\d{2}:\\d{2}Z$"
    },
    "seq": {
      "type": "integer",
      "minimum": 0
    },
    "T": {
      "type": [
        "number",
        "null"
      ]
    },
    "Td": {
      "type": [
        "number",
        "null"
      ]
    },
    "RH": {
      "type": [
        "number",
        "null"
      ]
    },
    "P": {
      "type": [
        "number",
        "null"
      ]
    },
    "P_type": {
      "enum": [
        "slp",
        "station",
        "altimeter"
      ]
    },
    "batt_v": {
      "type": [
        "number",
        "null"
      ]
    },
    "cadence_min": {
      "type": "integer",
      "minimum": 1
    },
    "source": {
      "enum": [
        "ghcnh_synop",
        "ghcnh_metar",
        "ghcnh_speci",
        "asos1min",
        "esp32"
      ]
    },
    "qc": {
      "type": "object",
      "additionalProperties": {
        "type": [
          "string",
          "null"
        ]
      }
    }
  },
  "additionalProperties": false
}
